<!ELEMENT dataset (
    EMPLOYEE*)>

<!ELEMENT EMPLOYEE EMPTY>
<!ATTLIST EMPLOYEE
    CF CDATA #REQUIRED
    AGE CDATA #IMPLIED
    SALARY CDATA #IMPLIED
    MANAGER_CF CDATA #IMPLIED
>

